{
  "schema_version": 1,
  "source": {
    "commit": "0123456789abcdef0123456789abcdef01234567",
    "tree": "89abcdef0123456789abcdef0123456789abcdef"
  },
  "chart": {
    "repository": "111111111111.dkr.ecr.sa-east-1.amazonaws.com/deepref/chart",
    "version": "1.4.0",
    "digest": "sha256:aaaaaaaaaaaaaaaaaaaaaaaaaaaaaaaaaaaaaaaaaaaaaaaaaaaaaaaaaaaaaaaa",
    "referrers": [
      {
        "digest": "sha256:1111111111111111111111111111111111111111111111111111111111111111",
        "mediaType": "application/vnd.oci.image.manifest.v1+json",
        "artifactType": "application/vnd.dev.cosign.simplesigning.v1+json"
      }
    ]
  },
  "images": {
    "api": {
      "repository": "111111111111.dkr.ecr.sa-east-1.amazonaws.com/deepref/api",
      "digest": "sha256:bbbbbbbbbbbbbbbbbbbbbbbbbbbbbbbbbbbbbbbbbbbbbbbbbbbbbbbbbbbbbbbb",
      "referrers": [
        { "digest": "sha256:2111111111111111111111111111111111111111111111111111111111111111", "mediaType": "application/vnd.oci.image.manifest.v1+json", "artifactType": "application/vnd.dev.cosign.simplesigning.v1+json" },
        { "digest": "sha256:2122222222222222222222222222222222222222222222222222222222222222", "mediaType": "application/vnd.oci.image.manifest.v1+json", "artifactType": "application/vnd.in-toto+json" },
        { "digest": "sha256:2133333333333333333333333333333333333333333333333333333333333333", "mediaType": "application/vnd.oci.image.manifest.v1+json", "artifactType": "application/spdx+json" },
        { "digest": "sha256:2144444444444444444444444444444444444444444444444444444444444444", "mediaType": "application/vnd.oci.image.manifest.v1+json", "artifactType": "application/vnd.in-toto+json" }
      ]
    },
    "worker": {
      "repository": "111111111111.dkr.ecr.sa-east-1.amazonaws.com/deepref/worker",
      "digest": "sha256:cccccccccccccccccccccccccccccccccccccccccccccccccccccccccccccccc",
      "referrers": [
        { "digest": "sha256:3111111111111111111111111111111111111111111111111111111111111111", "mediaType": "application/vnd.oci.image.manifest.v1+json", "artifactType": "application/vnd.dev.cosign.simplesigning.v1+json" },
        { "digest": "sha256:3122222222222222222222222222222222222222222222222222222222222222", "mediaType": "application/vnd.oci.image.manifest.v1+json", "artifactType": "application/vnd.in-toto+json" },
        { "digest": "sha256:3133333333333333333333333333333333333333333333333333333333333333", "mediaType": "application/vnd.oci.image.manifest.v1+json", "artifactType": "application/spdx+json" },
        { "digest": "sha256:3144444444444444444444444444444444444444444444444444444444444444", "mediaType": "application/vnd.oci.image.manifest.v1+json", "artifactType": "application/vnd.in-toto+json" }
      ]
    },
    "web": {
      "repository": "111111111111.dkr.ecr.sa-east-1.amazonaws.com/deepref/web",
      "digest": "sha256:eeeeeeeeeeeeeeeeeeeeeeeeeeeeeeeeeeeeeeeeeeeeeeeeeeeeeeeeeeeeeeee",
      "referrers": [
        { "digest": "sha256:5111111111111111111111111111111111111111111111111111111111111111", "mediaType": "application/vnd.oci.image.manifest.v1+json", "artifactType": "application/vnd.dev.cosign.simplesigning.v1+json" },
        { "digest": "sha256:5122222222222222222222222222222222222222222222222222222222222222", "mediaType": "application/vnd.oci.image.manifest.v1+json", "artifactType": "application/vnd.in-toto+json" },
        { "digest": "sha256:5133333333333333333333333333333333333333333333333333333333333333", "mediaType": "application/vnd.oci.image.manifest.v1+json", "artifactType": "application/spdx+json" },
        { "digest": "sha256:5144444444444444444444444444444444444444444444444444444444444444", "mediaType": "application/vnd.oci.image.manifest.v1+json", "artifactType": "application/vnd.in-toto+json" }
      ]
    }
  },
  "migration_version": "0008",
  "created_at": "2026-08-04T20:15:30Z"
}
